{
  "$schema": "../../schema/v1/json/test-data-catalog.schema.json",
  "kind": "testDataCatalog",
  "schemaVersion": 1,
  "configs": [
    {
      "id": "cluener-default",
      "path": "configs/cluener-default.json"
    }
  ],
  "novels": [
    {
      "id": "xianxia-source",
      "path": "novels/xianxia-source/manifest.json"
    },
    {
      "id": "xianxia-translation",
      "path": "novels/xianxia-translation/manifest.json"
    }
  ],
  "relations": [
    {
      "id": "translation-pair",
      "path": "relations/translation-pair.json"
    }
  ]
}
